DateTime,Uid,Tweet,Label (Specialist),HashTag
2021-09-17 0:50:51,d7f1de9e1a31,ช่วยให้เราได้ตายทีเถอะนะคะขอร้องเราไม่ไหวแล้ว,1,#โรคซึมเศร้า
2021-07-21 14:38:15,2f2e55cb88e7,มีคนนึงพูดไว้ว่าถ้าใช้ชีวิตแบบไร้ความพยายามไร้ความหมายก็ตายดีกว่าเราควรตายไปนานแล้วสินะ,1,#ซึมเศร้า #ปัญหาชีวิต
2021-05-30 17:00:40,2f2e55cb88e7,เธอเราเจ็บปวดกับชีวิตมากเลย,1,#โรคซึมเศร้า
2021-09-08 10:09:17,6fe9061b1fdf,ตาย,1,#โรคซึมเศร้า
2021-09-08 9:59:18,6fe9061b1fdf,เหนื่อยกับทุกๆปัญๆหาที่ผ่านเข้ามา,other,#โรคซึมเศร้า
2021-07-31 10:47:26,2f8ac3fbef66,ตอนที่ฉันอยากลาโลกไปแม่มีแต่หนูนั่นแหละ,1,"#เหนื่อย
#อยากตาย"
2021-06-24 4:35:19,b3e2d017e8cb,อยากได้ยินคำพูดที่มาจากใจไม่ใช่คำพูดแค่ลมปาก,other,#หาความสุข #อยากตาย
2021-09-13 17:51:41,3fd587a1f2fe,อยากหายไปไม่อยากรับรู้อะไรอีกแล้ว,1,#รับทําการบ้าน #รับทําการบ้าน #รับเขียนเรียงความ #สลิ่มvsสามกีบ #โรคซึมเศร้า
2021-09-13 16:32:09,3fd587a1f2fe,ไม่เคยคิดสั้นที่จะฆ่าตัวตายจนมาถึงวันนี้ก็มีความคิดนี้อยู่ในหัว,2,#โรคซึมเศร้า
2021-09-13 9:20:57,3fd587a1f2fe,ทิ้งชีวิตไปเลยได้ไหม,1,#โรคเครียด #โรคซึมเศร้า
2021-07-03 11:11:58,2f671eb0dbc8,ลาก่อนทุกคน,5,#โรคซึมเศร้า
2021-08-22 16:03:35,cf3264cbd161,เอาล่ะฉันพร้อมแล้วลาก่อนนะโลกที่โหดร้ายฉันคิดมาดีแล้ว,5,"#พักผ่อน #เซ็กซี่ #โรงแรม #เหนื่อย 
#โรคซึมเศร้า"
2021-05-28 5:08:56,b7bc7792ccfe,เหนื่อยจังแค่เป็นเราทุกอย่างมันก็ดูแย่ไปหมดหรือว่าเราไม่สมควรมีชีวิตอยู่จริงๆ,1,#โรคซึมเศร้า
2021-09-12 19:55:32,b7bc7792ccfe,ทุกคนหวังต้องการทางออก,other,#โรคซึมเศร้า
2021-09-13 18:05:59,5be7e47ab2aa,พยายามนะพยายามมากที่จะไม่ติดทำร้ายตัวเองหรือวิธีการฆ่าตัวตายแต่ไม่เคยเอามันออกจากหัวได้เลย,2,#โรคซึมเศร้า
2021-09-17 17:35:43,5be7e47ab2aa,วิธีทำร้ายตัวเองตอนนี้มันรู้สึกแย่จริงๆขอวิธีอะไรก็ได้,3,#โรคซึมเศร้า
2021-09-03 14:11:54,2bb812284e29,รู้สึกร่างกายเบาๆเหมือนพนจะไม่ได้ตื่นมาอีกแล้วเลยแต่ก็คงคิดไปเองอีก,4,#โรคซึมเศร้า
2021-05-18 10:48:23,2bb812284e29,ถ้าวันนึงเราไม่อยู่แล้วคุณไม่ต้องโทษใครเราอยากให้คุณโทษตัวเองเพราะที่เราเป็นแบบนี้ก็เพราะคุณคนเดียว,1,#โรคซึมเศร้า
2021-09-07 16:25:59,cf2ab2d89334,กรีดคราวนี้เจ็บกว่าครั้งก่อนๆ,5,#โรคซึมเศร้า #โรคเครียด
2021-07-16 13:20:37,a3ef144f8f75,โลกนี้มันไม่น่าอยู่เลยเนอะ,1,#โรคซึมเศร้า
2021-08-10 5:01:49,4fd13f12c94d,ก็เราแย่เราเศร้าเพราะเขาทำนี่จะให้เราไประบายกับใครกับแขนหรอก็น่าสนใจนะ,4,#โรคซึมเศร้า
2021-09-04 20:51:10,f390afa2d7a8,เผลอกินยานอนหลับไปเม็ดเลยจำไม่ได้ว่ากินไปเเล้วกินอีกจะเป็นผลเสียไรไหม,4,#โรคซึมเศร้า
2021-06-05 11:10:18,5fd01f8de6ee,เราต้องตายก่อนหรอหลายๆคนถึงจะพูดว่ารักคิดถึงเข้าใจ,1,#โรคซึมเศร้า
2021-07-19 21:59:58,5fd01f8de6ee,อยากตายจังขอวิธีการหน่อยได้ไหมคะ,3,#โรคซึมเศร้า
2021-08-06 18:43:56,5fd01f8de6ee,ผิดมั้ยที่จะหาเพื่อนโดดลงจากตึกที่ไหนซักที่โดดไปด้วยกัน,4,#โรคซึมเศร้า
2021-08-10 17:53:17,5fd01f8de6ee,เจ็บตรงใจจนอยากแทงให้มันหายเจ็บ,4,#โรคซึมเศร้า
2021-06-20 15:30:43,0741aa734504,คิดอยากตายทุกครั้งที่มีเรื่องให้เครียด,1,"#โรคซึมเศร้า #โรคเครียด #ซึมเศร้า 
#อยากตาย​ #แผนกจิตเวช"
2021-06-27 12:43:36,cfc9fc4cd870,เราทั้งกินยาทั้งรักษาตัวเองแต่ครอบครัวก็อยากเร่งให้เราตาย,1,#โรคซึมเศร้า
2021-06-29 4:09:11,cfc9fc4cd870,คำว่าตายได้ก็ดีพออินกับประโยคนี้กับร้องไห้ละอยากให้เป็นจริง,1,"#โรคซึมเศร้า #ซึมเศร้าเพื่อนรัก 
#เสียงกระซิบจากความมืด"
2021-07-16 12:13:07,cfc9fc4cd870,ทุกๆวันตื่นมาพร้อมกับความรู้สึกแม่งนี่กูยังไม่ตายอีกอ่อวะ,1,#เสียงกระซิบจากความมืด #โรคซึมเศร้า
2021-07-15 13:26:14,cfc9fc4cd870,อยากจะร้องไห้ออกมาให้ดังที่สุดแต่ทำไม่ได้ทำร้ายตัวเองได้แค่กัดตัวเองจนเลือดออก,3,#เสียงกระซิบจากความมืด #โรคซึมเศร้า
2021-07-09 14:16:06,13588cb47599,ถ้าความตายเป็นทางออกเมื่อไหร่จะเดินไปถึงสักที,1,#โรคซึมเศร้า
2021-07-12 19:54:25,13588cb47599,นอนโง่ๆให้น้ำตามันไหลพร้อมกับเลือดที่ไหลจากแขนทั้งสองข้างที่ไหลเปรอะเปื้อนเต็มที่นอน,4,#โรคซึมเศร้า
2021-04-07 2:54:53,878818836ed6,มีชีวิตอยู่ไปทำไม ทุกวันความคิดในหัวมีแต่คำว่าตาย,1,#โรคซึมเศร้า
2021-04-07 2:54:53,878818836ed6,โดดน้ำตายน่าจะเป็นวิธีที่ดีที่สุด,4,#โรคซึมเศร้า
2021-08-11 2:08:45,ff744531ac5d,คนที่ฆ่าตัวตายบางคนเขาไม่ได้คิดสั้นนะแต่เขาคิดมาแล้วว่านั่นคือทางออกที่ดีที่สุดสำหรับเขา,1,#โรคแพนิค #โรคซึมเศร้า
2021-04-04 16:24:18,6f1ec2ea9ac0,โดดน้ำตายน่าจะเป็นวิธีที่ดีที่สุด,4,#โรคซึมเศร้า
2021-05-14 13:22:41,b3952410d143,เมื่อทุกอย่างมันไม่เคยดีขึ้นฉันก็พร้อมที่จะไป,1,#โรคซึมเศร้า
2021-05-25 2:06:38,b3952410d143,แกว่าเรากินยาตายกับผูกคอตายอันไหนมันดีกว่ากัน,4,#โรคซึมเศร้า
2021-05-24 13:19:57,b3952410d143,กะอีแค่กรีดแขนลึกๆมันยากตรงไหนวะหมูทอดกระจอกว่ะไอ้ขี้แพ้อ่อนแอตายๆไปซะไป๊ตายไปเลยอีเหี้ย,4,#โรคซึมเศร้า
2021-05-18 12:14:17,b3952410d143,ไม่แปลกใจเลยทำไมโควิทถึงทำให้คนฆ่าตัวตายเรามีงานทำแต่ไม่มีทางไปเพราะต้องรอโควิดหมดยังอยากฆ่าตัวให้ตายๆไปซะเลย,2,#โรคซึมเศร้า
2021-06-29 12:57:06,b3952410d143,ตอนเด็กอยากโตโตมาอยากตาย,1,#โรคซึมเศร้า
2021-05-14 13:22:41,b3952410d143,เมื่อทุกอย่างมันไม่เคยดีขึ้นฉันก็พร้อมที่จะไป,1,#โรคซึมเศร้า
2021-05-24 5:10:56,b3952410d143,สิ่งที่หายากกว่าอนาคตก็คือรอยยิ้ม,other,#โรคซึมเศร้า
2021-08-06 13:48:35,9ba3d0b98cd0,การที่ฉันคิดจะฆ่าตัวตายก็คือฉันอยากตายไม่ใช่ฉันอยากนอนโรงบาลแล้วทำการรักษาดังนั้นปล่อยให้ฉันตายไปเถอะอย่ายื้อฉันเลย,4,#โรคซึมเศร้า
2021-08-10 14:42:01,9ba3d0b98cd0,ตายยังไงแบบไม่เจ็บ,3,#โรคซึมเศร้า
2021-08-10 14:29:33,9ba3d0b98cd0,ขอให้วันนี้คิดสั้นขาดสติ,2,#โรคซึมเศร้า
2021-08-12 13:30:59,9ba3d0b98cd0,วันนี้วันแม่ขอให้เป็นวันตายของเราด้วยได้รึป่าว,4,#โรคซึมเศร้า
2021-08-26 13:46:45,9ba3d0b98cd0,ต้องลงมีดลึกแค่ไหนถึงจะได้เลือด,4,#โรคซึมเศร้า
2021-05-18 5:22:15,9ba3d0b98cd0,กลางคืนทำไมมีแต่เรื่องแย่ๆเข้ามาในหัวจัง,1,#โรคซึมเศร้า
2021-09-17 11:58:44,9ba3d0b98cd0,ตอนไหนจะตาย,2,#เทมจัง#โรคซึมเศร้า#ความทรงจำสีจาง
2021-07-24 15:46:03,a3f04d2b4c4e,ขอโทษนะร่างกายเราทำร้ายแกอีกแล้ว,4,#โรคซึมเศร้า
2021-07-18 4:10:03,630fc82930db,คำว่าเบื่อที่หมายถึงเบื่อที่จะมีชีวิตอยู่แล้วรู้จักไหม,1,#ซึมเศร้า
2021-07-16 13:14:19,630fc82930db,อยากตายแต่กูกลัวหมากูไม่มีคนดูแล,1,#ซึมเศร้า
2021-08-25 8:27:26,0781b12b5427,เหนื่อยเนาะเหนื่อยจนไม่อยากอยู่ต่อเลย,1,#โรคซึมเศร้า
2021-07-05 12:15:35,23a91f52ff29,บางทีก็เคยคิดว่าตายตอนนี้ก็ไม่ต้องพยายามอะไรอีกเเล้ว,2,#โรคซึมเศร้า
2021-05-30 12:46:58,6397e5f7331e,ขามีแต่แผลเอาเล็บจิกกับข่วนตัวเองจนเลือดออกเต็มไปหมดเลยแล้วก็บอกคนอื่นว่ายุงกัดแล้วเกาจนเป็นแผล,4,#โรคซึมเศร้า
2021-06-02 13:36:25,5324f7cf328a,ล่าสุดคนที่เราคิดว่าเขารักเราแนะนำให้เราผูกคอตายเออดีเหมือนกัน,4,#โรคซึมเศร้า
2021-07-03 6:58:21,9b2cc1bdeabe,แค่ทุกคนลืมวันเกิดเราต้องเสียใจขนาดนี้เลยเหรอแน่ล่ะสิทุกคนคงไม่อยากให้เราเกิดมา,1,#โรคซึมเศร้า
2021-05-24 1:00:00,8376994c7abb,นี่ๆจะให้เราอยู่มาถึงตอนนี้ทำไมหรอไม่รีบให้เราตายซักทีหรือยังทรมาณเราไม่พออีก,1,#THAIWECARE #โรคซึมเศร้า
2021-05-24 1:00:00,8376994c7abb,นี่ๆจะให้เราอยู่มาถึงตอนนี้ทำไมหรอไม่รีบให้เราตายซักทีหรือยังทรมาณเราไม่พออีก,1,#THAIWECARE #โรคซึมเศร้า
2021-05-24 1:00:00,8376994c7abb,เหนื่อยท้อเบื่ออยากตายและก็วนเวียนอยู่อย่างนั้น,1,#THAIWECARE #โรคซึมเศร้า
2021-05-31 14:10:00,8376994c7abb,เหตุผลที่จะอยู่ต่อมันไม่มีจริงๆนะใช้ชีวิตไปวันๆ,1,#โรคซึมเศร้า
2021-05-24 9:50:32,bb89828ca9bb,วันนี้เป็นวันเกิดเราหวังให้ของขวัญคือความตายแบบไม่เจ็บปวดเหนื่อยแล้ว,5,#โรคซึมเศร้า
2021-05-19 12:01:43,bb89828ca9bb,ลาก่อนทุกสิ่งทุกอย่างที่ฉันรักขอโทษ,5,#โรคซึมเศร้า
2021-05-19 11:20:39,bb89828ca9bb,เราคิดว่าเราดีขึ้นแล้วแต่ไม่เลยเราแค่คิดไปเองเราอยากตายเราเบื่อชีวิตเฮงซวยแบบนี้ของเราแล้ว,1,#โรคซึมเศร้า
2021-06-22 16:37:42,a32a98990dad,เหนื่อยจังเลยใกล้จะได้พักแล้วใกล้จะจากกันแล้วนะทวิตเตอร์,4,#อยากตาย
2021-06-26 22:37:44,f32efea2f890,ความตายมันคือสิ่งสวยงามซึ่งคนที่ไม่เคยผิดหวังหรือหมดหวังอย่างผมคงไม่มีวันเข้าใจ,1,#โรคซึมเศร้า
2021-05-14 14:31:16,f30880893e0f,อยากตายแล้วแหละ,1,#โรคซึมเศร้า
2021-06-24 5:16:10,f30880893e0f,ตายตอนนี้เลยไม่ได้หรอ,2,#โรคซึมเศร้า
2021-07-06 10:54:12,f30880893e0f,อยากขายเลือดขายแขนขายขาขายตาขายชีวิตขายให้หมดเอาเงินไปนะแม่นะหนูไม่ไหวแล้ว,4,#โรคซึมเศร้า
2021-08-12 15:22:53,f30880893e0f,ถ้าชีวิตมันยากมากก็แค่ตายไปดิ,1,#โรคซึมเศร้า
2021-07-13 18:25:28,2b8c65a7ee93,ชีวิตตอนนี้จะอยู่หรือจะไปก็ได้,1,#โรคซึมเศร้า
2021-07-23 17:38:26,2b8c65a7ee93,เกลียดความรู้สึกที่แบบว่ากูเหนื่อยชิบหายเลยเมื่อไรกูจะตายไปจากโลกนี้สักทีวะ,1,#โรคซึมเศร้า
2021-07-23 17:38:26,2b8c65a7ee93,ไม่อยากอยู่บนโลกนี้แล้ว,1,#โรคซึมเศร้า
2021-08-18 18:39:18,639da23d36b1,อยู่ๆก็ดันหลับตาแล้วกลั้นใจบีบคอตัวเองตลกดีว่ามั้ยเหนื่อยท้อปวดหัวไปหมด,4,#ซึมเศร้า
2021-08-18 18:39:18,639da23d36b1,อยู่ๆก็ดันหลับตาแล้วกลั้นใจบีบคอตัวเองตลกดีว่ามั้ยเหนื่อยท้อปวดหัวไปหมด,4,#ซึมเศร้า
2021-09-07 19:49:56,639da23d36b1,เกิดมาแทบจะไม่เคยได้เลือกทางเดินเองเลยต้องคอยขอให้คนอื่นเลือกให้ตลอดตายคงเป็นสิ่งเดียวที่ได้เลือกเอง,1,#ซึมเศร้า
2021-09-04 16:30:26,57e8244956ef,เหนื่อยที่จะต้องมีชีวิตอยู่,1,#โรคซึมเศร้า
2021-05-14 14:30:46,933b6e4745d0,กูไม่อยากอยู่แล้วกูเหนื่อยจะตายอยู่แล้ว,1,#อกหัก #โรคซึมเศร้า
2021-05-14 14:30:46,933b6e4745d0,กูไม่อยากอยู่แล้วกูเหนื่อยจะตายอยู่แล้ว,1,#อกหัก #โรคซึมเศร้า
2021-07-05 13:18:42,43090d482e69,ตายมันทรมานน้อยกว่าที่เป็นอยู่ตอนนี้ไหมอะถ้าใช่จะได้ทำ,1,#โรคซึมเศร้า
2021-06-30 15:23:11,4f2426bb8d47,ขอแบบไม่ทรมานอีกแล้วให้มันจบสักทีเถอะ,2,#อยากตาย
2021-06-22 14:43:12,573695d4ea4c,ว่ามั้ยตอนที่เราเศร้าเสียใจทำไมถึงไม่มีใครอยู่ข้างพวกเราเลย,other,"#โรคซึมเศร้า #ฆ่าตัวตาย #อยากตาย 
#อยากฆ่าตัวตาย"
2021-07-06 9:50:27,c36d21bbcee5,อยู่ไปก็เหมือนตายอยู่แล้วนิเน้อะตายทั้งเป็น,1,#โรคซึมเศร้า
2021-09-09 5:53:02,8b3db1db4992,ตายตายไปซ่ะให้หมดก็ดีรวมถึงตัวเราด้วยเหนื่อย,1,#โรคซึมเศร้า
2021-06-29 10:26:00,17dbb2e1ff02,พยายามฆ่าตัวตายมาแล้วหลายรอบแต่ก็รอดมาได้ไม่ได้มีความสุขหรอกนะมันทรมานมากๆเลยที่รอดมาได้,2,#โรคซึมเศร้า
2021-07-08 15:15:37,17dbb2e1ff02,ทุกวันนี้ใช้ชีวิตโดยที่ไม่ได้คาดหวังให้มีวันพรุ่งนี้ใช้ชีวิตเหมือนกำลังนับวันรอวันตาย,1,#โรคซึมเศร้า #เบื่อ
2021-07-15 16:48:00,17dbb2e1ff02,การใช้ชีวิตมันเจ็บปวด,other,#โรคซึมเศร้า
2021-07-22 16:14:30,17dbb2e1ff02,อยากจากโลกนี้ไปอย่างสงบ,1,#โรคซึมเศร้า
2021-07-24 15:14:42,17dbb2e1ff02,อยากตายอ่ะเหนื่อย,1,#โรคซึมเศร้า
2021-08-06 17:55:34,17dbb2e1ff02,ดูหนังเรื่องหนึ่งพอมีคนใกล้ตายจะมีอีกคนเข้ามาปลอบว่าเจ้าจะไม่เจ็บปวดอีกต่อไปก็จริงนะ,1,#โรคซึมเศร้า
2021-08-10 23:51:16,17dbb2e1ff02,เอาผ้าห่มกดหน้าตัวเองแล้วลาโลกดีไหมนะ,4,#โรคซึมเศร้า #ภาวะซึมเศร้า #คิดสั้น
2021-08-12 17:50:36,17dbb2e1ff02,เวลาของคนอยากตายนี่มันเดินช้าจังเลยนะเพราะมันทรมานทุกเสี้ยววินาทีจริงๆ,1,#โรคซึมเศร้า #ซึมเศร้า
2021-09-10 17:48:33,17dbb2e1ff02,วันนี้แม่มาอยู่เป็นเพื่อนเพราะอยู่คนเดียวแล้วจะทำร้ายตัวเอง,5,#โรคซึมเศร้า
2021-09-17 12:02:56,17dbb2e1ff02,สาวป่วยซึมเศร้าสั่งแซลมอนมื้อสุดท้ายเตรียมลาโลกสุดท้าย,5,#โรคซึมเศร้า
2021-06-03 16:24:48,4b58bd42f1c8,ถึงผมไม่อยากตายแต่ผมก็ไม่อยากมีชีวิตอยู่,1,#ซึมเศร้าเพื่อนรัก #โรคซึมเศร้า
2021-08-31 1:05:02,bbf0af6211cb,กูพยายามอย่างบ้าคลั่งพยายามทำทุกอย่างให้ดีขึ้นสุดท้ายกูก็ไม่ดีอยู่ดีกูก็ผิดอยู่ดีกูคงทำอะไรให้ดีขึ้นไม่ได้สินะนอกจากการตาย,1,#รับจ้างคุย #หาเพื่อนคุย #หาคนคุย #เหงา
2021-05-30 14:07:00,6f3c93b874ef,ลาก่อนโลกใบนี้ลาก่อนทุกอย่างเราจะทิ้งทุกอย่างไปกับความตาย,5,#โรคซึมเศร้า
2021-06-16 13:12:35,6f3c93b874ef,บางทีวันเกิดผมที่กำลังมาถึงมันอาจจะกลายเป็นวันตายของผมก็ได้นะครับ,4,#โรคซึมเศร้า
2021-06-28 16:48:05,6f3c93b874ef,ตอนเด็กแม่เคยบอกเราว่าแม่สั่งทำอะไรก็ให้ทำตามพอเราโตมาแม่สั่งให้เราไปตายเราควรไปตายตามที่แม่บอกดีมั้ยคะ,1,#โรคซึมเศร้า 
2021-07-10 6:53:30,6f3c93b874ef,เห็นแผลที่คนอื่นละรู้สึกกลัวนิดๆแต่มามองอีกทีก็ไม่ได้แต่อะไรจากเราเลย,4,#โรคซึมเศร้า  
2021-07-19 15:58:43,6f3c93b874ef,เมื่อไหร่จะตายสักทีไม่อยากอยู่แล้ว,1,#โรคซึมเศร้า
2021-08-17 16:05:50,6f3c93b874ef,มีใครรู้มั้ยคะกินพาราประมาณเท่าไหร่ถึงจะตาย,3,#โรคซึมเศร้า 
2021-05-19 17:49:11,6f3c93b874ef,ภายนอกยิ้มแย้มแจ่มใสแต่ในใจแหลกสลายไม่เหลือชิ้นดี,1,#โรคซึมเศร้า
2021-05-30 14:05:56,6f3c93b874ef,ขามีแต่แผลเอาเล็บจิกกับข่วนตัวเองจนเลือดออกเต็มไปหมดเลยแล้วก็บอกคนอื่นว่ายุงกัดแล้วเกาจนเป็นแผล,4,#โรคซึมเศร้า
2021-09-18 11:47:45,6f3c93b874ef,ชมนอีกนิดนะเดี๋ยวก็ตายแล้ว,1,#โรคซึมเศร้า
2021-09-07 12:02:38,979ad0817ec3,ไม่อยากอยู่แล้ว,1,#โรคซึมเศร้า
