DateTime,Uid,Tweet,Label (Specialist),HashTag
2021-07-19 16:15:44,63623d65b1e5,ถึงทุกคนที่กำลังรู้สึกอยากจะหายไปจากโลกใบนี้,other,#โรคซึมเศร้า
2021-05-18 13:01:48,cf1879a9eaee,การที่ตื่นมาแล้วพบว่าตัวเองยังหายใจอยู่นี่ทรมานจัง,1,#โรคซึมเศร้า
2021-08-12 10:56:55,d39b3f356a6e,ขอวิธีจัดการตัวไม่ให้ทำร้ายตัวเองได้มั้ยคะเวลาหนูเครียดหรือซึมหนูอยากทำร้ายตัวเองตลอดเลยไม่ก็พยายามฆ่าตัวตาย,5,#สุขภาพจิต #โรคซึมเศร้า #ระบาย
2021-08-22 14:45:57,6f387c39cd37,อยากมีเงินใช้หนี้ตายไปคนข้างหลังจะได้ไม่ลำบาก,1,#อยากตาย
2021-08-22 14:45:57,6f387c39cd37,กูไม่ควรเกิดมาจริงๆ,other,#อยากตาย
2021-07-03 4:34:53,d7c681ec8bce,ถ้าเราฆ่าตัวตายไม่สำเร็จทุกคนจะหาว่าเราเรียกร้องความสนใจเเต่ถ้าหากเราทำสำเร็จทุกคนอาจจะหันมารักเรา,2,#โรคซึมเศร้า
2021-04-07 7:58:55,472f65e0814d,ระบายให้ใครฟังไม่ได้ทั้งนั้น สุดท้ายก็ต้องระบายกับเลือดที่แขนของตัวเอง,5,#โรคซึมเศร้า
2021-09-14 5:48:41,130e97011527,อยากตายแต่กลัวความตายและไม่กล้าที่จะทำมันเป็นอะไรที่ทรมานชีวิตตัวเองมากเหมือนกันนะ,1,#โรคซึมเศร้า
2021-09-06 13:49:10,4701d3b64e24,ตายๆเลยดีมาก,2,#อยากตาย
2021-04-02 10:14:16,b7d6c26e38df,"เมื่อถึงจุดหนึ่ง...เราอาจต้องการแค่ ""ลมหายใจที่สงบนิ่งและหัวใจที่หยุดเต้น""",2,#โรคซึมเศร้า
2021-04-05 11:48:13,3b6e286f55af,อย่าได้เจ็บปวดอีกเลยนะคะเจ้าคนเก่งของเรา,other,#โรคซึมเศร้า
2021-09-11 9:59:14,4b45140c4ce9,เหตุผลในการมีชีวิตอยู่ไม่กล้าพอ,1,#โรคซึมเศร้า
2021-08-26 16:36:04,b3c123015825,ตอนนี้ความคิดเราเราตายไปแล้วตายไปหลายครั้งแล้ว,1,#โรคซึมเศร้า
2021-04-05 13:47:57,cba8794907b8,ถ้าเราหลับไปได้โปรดอย่าปลุกเราขึ้นมาอีกเลยนะ,1,#โรคซึมเศร้า
2021-05-31 17:27:39,ebb90766c029,มีวิธีไหนมั้ยนะที่ตื่นมาแล้วไม่เจอใครอีก,1,#โรคซึมเศร้า
2021-07-31 15:21:56,c7794b7bc8f5,ถ้าตายตอนนี้จะเป็นภาระสัปเหร่ออีกมั้ยแค่นี้ก็เผากันไม่ไหวแล้วถ้าไม่ตายเป็นภาระหมออีกเซ็งซวยชิบหายตัวฉัน,1,#ซึมเศร้า
2021-07-24 14:31:37,f710ba4533d4,ฉันเองก็อยากตายเร็วๆเหมือนกัน,1,#โรคซึมเศร้า
2021-05-24 4:16:30,f710ba4533d4,มันแย่ตรงพอจะตายกลับมานึกถึงคนที่เขาขอให้เรามีชีวิตอยู่ต่อแล้วแบบนี้เราจะไปจากที่นี่ได้ไง,2,#โรคซึมเศร้า
2021-08-18 12:20:59,eb0a95837e00,โมโหหายใจแรงเร็วแล้วก็ทำร้ายตัวเองเห้อออ,5,#โรคซึมเศร้า
2021-08-17 14:18:42,eb0a95837e00,ข้าแต่พระบิดาของข้าพเจ้าทั้งหลายพระองค์สถิตย์ในสวรรค์โปรดทรงรับข้าพเจ้าไปอยู่ด้วยเสียที,2,#โรคซึมเศร้า
2021-08-17 14:13:33,eb0a95837e00,เวลาที่ทำร้ายตัวเองแล้วแม่ถามว่าไม่กลัวตายหรอใช่ฉันตอบในใจว่าฉันก็อยากตายอยู่แล้วนี่,5,#โรคซึมเศร้า
2021-04-05 12:00:26,0792ef33e83a,อย่าได้เจ็บปวดอีกเลยนะคะเจ้าคนเก่งของเรา,other,#โรคซึมเศร้า
2021-06-24 7:15:09,e75522dfa755,พอแล้วๆๆเราอยากพอกับชีวิตแย่ๆแบบนี้เราตายได้มั้ย,2,"#โรคซึมเศร้า #ซึมเศร้า #ซึมเศร้าเพื่อนรัก #ไบโพล่าร์ 
#เสียงกระซิบจากความมืด #อยากตาย #ความตาย"
2021-08-04 10:25:51,e75522dfa755,อยากตายว่ะเบื่อโรคนี้มากเมื่อไรมันจะหายๆซักทีว่ะเฮงซวย,2,#โรคซึมเศร้า #ซึมเศร้า #ซึมเศร้าเพื่อนรัก #ไบโพล่าร์
2021-08-04 15:09:16,e75522dfa755,ตายไปไม่ดีกว่าหรอ,1,#โรคซึมเศร้า #โรคเครียด #ซึมเศร้า #ซึมเศร้าเพื่อนรัก
2021-08-22 10:40:00,e75522dfa755,ขอโทษนะที่ฉันเกิดมาทำให้เธอเศร้าหมอง,other,"#โรคซึมเศร้า #โรคเครียด #ซึมเศร้า #ซึมเศร้าเพื่อนรัก 
#ไบโพล่าร์ #เสียงกระซิบจากความมืด #อยากตาย"
2021-08-21 13:15:57,e75522dfa755,เป็นคนที่มีชีวิตที่ว่างเปล่าไร้ซึ่งเป้าหมายเเละแรงจูงใจ,other,"#โรคซึมเศร้า #โรคเครียด #ซึมเศร้า #ซึมเศร้าเพื่อนรัก 
#ไบโพล่าร์ #เสียงจากกระซิบจากความมืด"
2021-08-22 10:40:00,e75522dfa755,อยากลองตกจากที่สูงๆ,4,"#โรคซึมเศร้า #โรคเครียด #ซึมเศร้า #ซึมเศร้าเพื่อนรัก 
#ไบโพล่าร์ #เสียงกระซิบจากความมืด #อยากตาย"
2021-09-06 11:54:17,e75522dfa755,ความตายเป็นเรื่องธรรมดาขึ้นอยู่กับเวลาที่เรายังเหลืออยู่แต่เราอยากให้เธอมีความสุขทุกนาทีที่ยังอยู่บนโลกที่โหดร้ายใบนี้นะ,other,#อยากตาย
2021-06-30 4:13:38,d71467d732b1,แค่เห็นมีดก็คิดไปทั่วแล้ว,4,#โรคซึมเศร้า
2021-08-25 16:24:15,gggg30703260,ทำไมไม่เคยได้ตายทั้งที่อยากตาย,2,#โรคซึมเศร้า #อยากตาย #ตัวคนเดียว
2021-08-25 16:25:16,gggg30703260,ความสุขคืออะไรไม่รู้เหมือนกันฉันไม่เคยมีความสุขจริงๆซักครั้งในชีวิต,other,#โรคซึมเศร้า #อยากตาย #ไร้ค่า
2021-08-25 16:24:15,gggg30703260,คิดว่าการมีชีวิตแบบนี้ดีที่สุดแล้วหรอเสแสร้งปกปิดปิดกั้นถูกกระทำเจ็บปวดและทุกทรมาน,other,#โรคซึมเศร้า #อยากตาย #ตัวคนเดียว
2021-08-30 18:14:24,gggg30703260,ฉันกลัวการจมน้ำมากที่สุดถ้างั้นฉันเลือกการจมน้ำตายก็แล้วกัน,4,#ตัวคนเดียว #โรคซึมเศร้า #น้อยใจ #ครอบครัวไม่ใช่เซฟโซน
2021-09-03 10:24:55,gggg30703260,เหนื่อยอยากหายไปมีใครได้ยินเสียงเราบ้างมั๊ย,1,#อกหัก #ตัวคนเดียว #ซึมเศร้า
2021-08-01 17:11:26,37d465a6c9d8,ตอนเด็กๆสิ่งที่กลัวที่สุดคือกลัวตายแต่พอโตมาสิ่งที่อยากได้ที่สุดคืออยากตาย,2,#บันทึกของกอด #โรคซึมเศร้า
2021-07-13 9:48:14,37257b86f98a,อยากตายจริงๆทรมานไม่ไหวแล้ว,2,#โรคซึมเศร้า
2021-07-12 15:03:00,37257b86f98a,ฉันเองก็อยากตายเร็วๆเหมือนกันมีชีวิตก็ต้องพยายามถ้าตายไปซะก็ไม่ต้องพยายามแล้ว,2,#โรคซึมเศร้า
2021-05-19 16:17:03,37257b86f98a,เลือกได้กูก็ไม่อยากเกิดมาเป็นภาระหรอกนะ,other,#โรคซึมเศร้า
2021-06-26 7:14:05,77f0e06aa18d,เราไม่มีความคิดที่จะอยู่บนโลกนี้ต่อเลยอยากจบชีวิตนี้ให้ไวๆแต่ก็ได้แค่คิด,2,#โรคซึมเศร้า
2021-06-26 4:48:33,77f0e06aa18d,ขอให้ฉันไม่ตายด้วยความตั้งใจของตัวเอง,1,#โรคซึมเศร้า
2021-06-26 14:32:12,77f0e06aa18d,ไม่ได้อยากตายแต่มันเหนื่อยที่อยู่ต่อไหวข้างในมันเจ็บปวดเกินไปจนทนไม่ไหวแล้ว,other,#โรคซึมเศร้า
2021-07-09 18:23:11,3322097a4f0f,ตายๆไปมันก็จบป่ะวะจะได้ไม่คาดหวังแล้วก็จะได้ไม่ผิดหวังไง,1,#โรคซึมเศร้า เกิดขึ้นมาได้
2021-07-05 4:12:11,c7a05bb7cf04,ทำอย่างไรให้ตาย,3,#โรคซึมเศร้า
2021-07-04 16:36:15,c7a05bb7cf04,ไม่ได้อยากตายนะเเต่ไม่อยากตื่นเลยอยากหายไปจากโลกใบนี้,1,#โรคซึมเศร้า
2021-06-16 13:46:02,1b722010eee9,ถ้าจะขนาดนี้อย่าเกิดเรามาเลยจะดีกว่า,other,#โรคซึมเศร้า  #โดดเดี่ยว #อยากตาย
2021-06-16 13:46:02,1b722010eee9,กูอยากตายกูอยากลบตัวตนของกู,1,#โรคซึมเศร้า  #โดดเดี่ยว #อยากตาย
2021-08-17 15:13:38,f3932b6a7b37,มันกลับมาอีกแล้วการอยากตายของฉัน,2,#โรคซึมเศร้า
2021-08-01 17:00:02,afef71324cd1,อีกนิดมึงจะทำได้แล้วนะ,4,#อยากตาย
2021-08-04 15:29:24,afef71324cd1,อยากตายแต่ไม่กล้าพอ,1,#อยากตาย
2021-02-23 17:26:18,4ba66ae63cc5,จะให้ตายตอนนี้เลยก็ได้ส่งปืนมาดิ จะไม่พลาดแน่นอนถ้ายิงแล้วยังไม่ตายจะยิงซ้ำเรื่อยๆเอง ที่เลือกวิธีนี้ก็เพราะมันเร็วที่สุดแล้ว,5,##อยากตาย
2021-02-23 18:17:10,4ba66ae63cc5,จะทนกับตัวเองที่อยากตายวันละหลายๆรอบได้ยังไง,2,#โรคซึมเศร้า
2021-02-23 18:45:44,4ba66ae63cc5,ตื่นมาพร้อมกับคำว่าอยากตายในทุกๆเช้า,2,#โรคซึมเศร้า
2021-07-20 12:18:05,bf0c6613581c,พยายามที่จะตาย,3,#อยากตาย
2021-08-02 1:12:27,13d8f388096e,กูอยากตายให้กูไปได้แล้วเหอะนะขอล่ะไม่เอาแล้วเหนื่อยทรมานจริงมากๆที่สุดอยากจะแขวนคอตาย,5,#โรคซึมเศร้า
2021-08-26 14:24:38,13d8f388096e,เราเหนื่อยจังเลยเหนื่อยมากๆผูกคอกรีดตัวเองทั้งแขนท้องขาไม่ไหวแล้ว,5,#โรคซึมเศร้า
2021-08-25 12:12:29,13d8f388096e,ทุกวันที่ตื่นขึ้นมาฉันมักถามตัวเองซ้ำๆว่ายังไม่ตายอีกเหรอยังต้องตื่นมาอีกเหรอพอแล้วได้ไหมปล่อยฉันหลับไหลไปเถอะนะ,1,#โรคซึมเศร้า
2021-08-27 14:19:31,13d8f388096e,ทำทุกอาทิตย์เพื่อหวังว่าอะไรๆมันจะดีขึ้นแต่กลับมาบ้านก็ดิ่งเหมือนเดิมแย่อยากตาย,1,#โรคซึมเศร้า
2021-05-22 19:20:53,13d8f388096e,ใครละที่จะเข้าใจเหนื่อยสุดๆไปเลยทุกอย่างมันถาโถมเข้ามาหมด,other,#โรคซึมเศร้า
2021-05-22 18:57:22,13d8f388096e,ไม่อยากให้ถึงวันนั้นเลยวันที่เส้นสุดท้ายของความอดทนได้ขาดลงไป,other,#โรคซึมเศร้า
2021-09-07 19:13:15,13d8f388096e,เมื่อไหร่จะตาย,1,#โรคซึมเศร้า
2021-09-07 19:11:02,13d8f388096e,ถ้าเราตายวันนี้พรุ่งนี้เราไม่ทรมานแต่ถ้าเราตายพรุ่งนี้วันมะรืนเราจะไม่ทรมานสินะ,4,#โรคซึมเศร้า
2021-09-06 11:48:51,13d8f388096e,ที่บอกว่าอยากตายไม่เคยพูดเล่นเลยนะ,2,#โรคซึมเศร้า
2021-09-18 5:54:38,13d8f388096e,ได้โปรดฉันไม่ต้องการมีชีวิตอีกต่อไป,2,#โรคซึมเศร้า
2021-09-17 13:20:52,13d8f388096e,วันนี้เราจะตายแล้วแต่ยังตัดสินใจไม่ได้ว่าจะตายยังไงดีขอคำปรึกษาหน่อยค่ะเราแค่อยากหลับไม่อยากเจ็บปวด,3,#โรคซึมเศร้า
2021-05-27 16:28:40,d37f39d5f5b3,อยากให้กูทำทุกอย่างที่ไม่มีความสุขก็จะทำให้เพื่ออะไรวะสู้ตายไปดีกว่าจบ,2,#โรคซึมเศร้า
2021-09-18 9:40:32,3f2c52f28edb,ทรมานมากเลยยิ่งมีชีวิตอยู่ยิ่งแตกสลายจะหลุดพ้นไปจากตรงนี้ได้ยังไง,other,#โรคซึมเศร้า
2021-03-31 23:35:48,dbdb834614f5,ถ้าสมุดเดธโน๊ตมีจริง ฉันจะเขียนชื่อของฉันลงสมุด :),1,#โรคซึมเศร้า
2021-03-31 23:29:19,dbdb834614f5,จุดนี้คือจุดที่เราไม่ควรจะอยู่ เอาจริง ๆ ก็ไม่น่าเกิดมาตั้งแต่แรก,other,#โรคซึมเศร้า
2021-08-28 23:53:57,57a4363b3b45,จะอยู่ก็ลำบากคนอื่นจะตายก็ยังทำให้คนอื่นลำบากเราควรอยู่ส่วนไหนของโลกใบนี้ได้บ้างมีที่ไหนที่พอจะให้เรายืนบ้าง,other,#โรคซึมเศร้า
2021-08-27 13:37:48,57a4363b3b45,เราเหนื่อยจังเลยเหนื่อยมากๆผูกคอกรีดตัวเองทั้งแขนท้องขาไม่ไหวแล้ว,4,#โรคซึมเศร้า
2021-09-03 19:06:50,57a4363b3b45,ภาพสุดท้ายก่อนใกล้ถึงความตายไม่มีภาพอดีตไร้สาระอะไรทั้งนั้นมีแต่ภาพสีขาวในหัว,5,#โรคซึมเศร้า
2021-09-07 10:49:38,57a4363b3b45,ไม่มีภาพวันพรุ่งนี้อยู่ในหัวสมองเราเลย,2,#โรคซึมเศร้า
2021-06-23 14:16:44,67bb15525d70,กินกี่เม็ดก็ไม่ตายต้องกินอะไรถึงตาย,5,#โรคซึมเศร้า
2021-07-03 9:27:12,67bb15525d70,ขอวิธีฆ่าตัวตายแบบไม่ฟื้นหน่อยค่ะหาเหตุผลอยู่ต่อไม่ได้เเล้วชีวิตไม่มีอะไรให้เสียเเล้ว,3,#โรคซึมเศร้า
2021-08-30 16:26:21,67bb15525d70,แค่พยายามผ่านไปให้ได้เเต่ละวันที่มีก็หมดแล้วเหลืออีกเท่าไหร่กันนะเวลาที่ต้องทรมานอยู่กับโลกใบนี้,other,#โรคซึมเศร้า
2021-05-24 13:01:29,d7611c9ce6b0,คิดนะว่าไม่ได้อยากตายแต่ชีวิตในตอนนี้มันทำให้คิดตลอดเลยว่ะ,2,#โรคซึมเศร้า
2021-07-21 1:51:19,6317d51684dd,เมื่อไรปัญหามันจะจบไปสักทีหรือเราต้องตายก่อนครอบครัวความรักการเรียน,1,#ซึมเศร้า
2021-07-25 10:41:29,6317d51684dd,เคยรู้สึกอยากตายไหมรู้สึกว่าตัวเองไร้ค่าด้อยค่าไม่มีอะไรดีไม่คู่ควรกับใครดาวลงทุกวันๆอาการแบบนี้ใช่,1,#ซึมเศร้า​ #ซึมเศร้าเพื่อนรัก
2021-07-21 8:33:13,533da656fa41,ระหว่างแม่ตายก่อนกับกูฆ่าตัวตายอันไหนจะเกิดขึ้นก่อนกัน,2,#ซึมเศร้า
2021-07-20 19:28:26,533da656fa41,ใครจะบ้าอดหลับอดนอนมันนอนไม่หลับยานอนหลับต้องเข้าแล้วแหละ,other,#ซึมเศร้า
2021-07-02 14:59:23,b34c0fdff530,พอกำลังจะตายก็มาร้องไห้ห้ามไว้พอคราวนี้ไล่ไปตายคืออะไรเหนื่อยว่ะเหนื่อยมาก,5,#โรคซึมเศร้า
2021-07-02 12:15:49,b34c0fdff530,ต้องตายเท่านั้นถึงจะจบสมใจ,2,#โรคซึมเศร้า
2021-08-03 14:40:40,9b26a55e8cf6,เราวางแผนฆ่าตัวตายในวันเกิดของตัวเอง,4,#ซึมเศร้า
2021-03-31 2:51:24,273d1b12716b,กำลังสู้อยู่กับอะไรน่ะหรอ บางทีคงจะเป็นความคิดที่ว่าอยากตายไปล่ะมั้ง..,2,#โรคซึมเศร้า
2021-01-27 4:20:00,37096e8fa8df,จะจากไปแบบไม่มีใครรู้เลยละ,4,#ปัญหาครอบครัว #ซึมเศร้า
2021-08-17 17:09:23,03845f12b473,เราแตกสลายจนไม่มีชิ้นส่วนที่สามารถประกอบกันได้อีกไม่อยากตื่นอีกแล้ว,1,#ซึมเศร้า  #เครียด
2021-08-17 17:09:23,03845f12b473,เราแตกสลายจนไม่มีชิ้นส่วนที่สามารถประกอบกันได้อีกไม่อยากตื่นอีกแล้ว,1,#ซึมเศร้า  #เครียด
2021-09-06 13:27:40,4fcec8bc0133,ไม่เคยมีความสุขเลยสักครั้ง,other,#โรคซึมเศร้า
2021-06-05 13:13:28,87506592a818,ที่บอกว่าอยากตายไม่เคยล้อเล่นเลยสักครั้ง,2,#โรคซึมเศร้า
2021-05-30 13:27:44,bbf9ecea5038,อยากรู้จังโลกหลังความตายเป็นยังไง,2,#โรคซึมเศร้า
2021-04-06 17:44:43,670c5d32041f,เที่ยงคืน เลือด และยา,5,#โรคซึมเศร้า
2021-08-10 9:29:09,2b08e52e0b0d,อยากตายจังเลย,1,#โรคซึมเศร้า
2021-09-17 20:11:23,2b08e52e0b0d,ขอฆ่าตัวตายแบบครั้งเดียวจบด้วยค่ะแบบไม่ต้องทรมาน,3,#โรคซึมเศร้า
2021-05-14 14:21:42,db51397240de,การตายน่าจะง่ายกว่าการมีชีวิตเยอะเลยนะ,1,#โรคซึมเศร้า
2021-05-14 14:18:59,db51397240de,เราไม่ไหวแล้วถ้าสติขาดวันนี้คือวันสุดท้าย,4,#โรคซึมเศร้า
2021-05-14 14:32:34,db51397240de,ที่เห็นว่าเหมือนจะดีขึ้นจริงๆแล้วมันไม่ใช่เลยก็ยังคิดที่อยากจะไปจากโลกนี้ทุกวัน,2,#โรคซึมเศร้า
2021-05-14 14:21:35,db51397240de,ขอโทษทำดีที่สุดแล้วจริงๆนะ,4,#โรคซึมเศร้า
2021-05-24 17:28:43,db51397240de,โลกใบนี้มันร้ายกับเราหรือเราอ่อนแอเองอยากตายว่ะไม่อยากอยู่แล้วปล่อยเราให้ตายเถอะ,1,#โรคซึมเศร้า
2021-05-18 8:10:44,db51397240de,คิดว่าอยากตายกี่รอบแล้ว,2,#โรคซึมเศร้า
2021-07-05 14:55:29,db51397240de,เห็นข่าวนรนศฆ่าตัวตายเพราะเครียดจากการเรียนออนไลน์กลัวตัวเองเหมือนกันว่าจะเป็นหนึ่งในนั้น,2,#โรคซึมเศร้า
2021-07-09 14:03:45,db51397240de,ลาก่อนถ้าไม่ตายค่อยเจอกันใหม่,5,#โรคซึมเศร้า
