DateTime,Uid,Tweet,Label (Specialist),HashTag
2021-05-18 7:24:39,a38755f80aee,ถ้าฉันตายไปจริงๆก็คงดีสินะ,2,#โรคซึมเศร้า
2021-05-20 16:06:12,a38755f80aee,เหนื่อยเหนื่อยจนจะตายอยู่แล้วมันไมกันนะนั่งเล่นเฉยๆหัวเราะอยู่ดีๆมันก็ดิ่งขึ้นมา,1,#โรคซึมเศร้า
2021-06-16 7:00:59,9b7d113b270a,พยายามที่จะมีชีวิตอยู่แต่ก็เหนื่อยกับโลกนี้เหลือเกินเหนื่อกับการใช้ชีวิตตอนนี้ฉันเหนื่อยเหนื่อยมากจริงๆ,1,#โรคซึมเศร้า
2021-05-28 18:43:41,0b981040c16d,ชีวิตก็มีอยู่แค่นี้อยากหายไปแล้วนะ,1,#โรคซึมเศร้า
2021-07-13 18:06:11,937c5794646d,วันวุ่นๆของวัยรุ่นกินยาเกินขนาดกรีดแขนพร้อม,5,#โรคซึมเศร้า
2021-06-01 5:47:16,57f512e6bc53,เมื่อไหร่นะที่หายไปจากโลกนี้ชีวิตแม่งไร้ค่า,1,#โรคซึมเศร้า
2021-05-20 15:51:43,63f76b567278,อยากตาย,1,#โรคซึมเศร้า
2021-07-19 16:27:01,c37c041e1dd4,อยากตายๆไปซะครอบครัวจะได้รักกูซักที,1,#โรคซึมเศร้า
2021-05-30 20:12:52,cba844c4b3ec,เวลาทนความเจ็บปวดไม่ไหวแล้วชอบทำร้ายตัวเองแก้ยังไงดีคะ,5,#โรคซึมเศร้า
2021-06-01 19:39:11,cba844c4b3ec,หาซื้อไซยาไนด์ครับไม่ก็ปืนถูกๆก็ได้ใครมีร้านที่พอจะรู้ช่วยมาหน่อยครับ,4,#โรคซึมเศร้า
2021-05-31 7:34:58,cba844c4b3ec,เหนื่อยแล้วตายยังไงเจ็บน้อยสุดอะ,3,#โรคซึมเศร้า
2021-09-02 9:45:22,e7b97df2790a,เราเหนื่อยเมื่อไหร่จะหลุดพ้นอะไรแบบนี้สักที,1,#ความสุขที่หายไป #ซึมเศร้า #ซึมเศร้าเพื่อนรัก
2021-05-21 1:50:53,873e1b3ad2b3,ไม่มีใครอยากตายหรอกเขาแค่กลัวการมีชีวิตเท่านั้นเอง,1,#โรคซึมเศร้า #ไบโพลาร์
2021-09-04 8:20:40,13e1d3929b31,มีอะไรที่ทำให้หายไปโดยที่ไม่ต้องฆ่าตัวตายมั้ยอยากจบชีวิตเอาไว้ตรงนี้เหนื่อย,1,#โรคซึมเศร้า
2021-09-04 8:16:39,13e1d3929b31,ไม่น่าเกิดมาเลยเบื่อเกลียดตัวเองชิบหาย,1,#โรคซึมเศร้า
2021-09-11 6:14:44,13e1d3929b31,ใกล้ถึงวันเกิดตัวเองแล้วสินะฆ่าตัวตายในวันเกิดดีมั้ยนะ,3,#โรคซึมเศร้า
2021-09-13 9:35:13,13e1d3929b31,ขอโทษนะที่เกิดมาไร้ค่าขนาดนี้,1,#โรคซึมเศร้า
2021-09-16 2:57:09,13e1d3929b31,ถ้าเรียนต่อจะตายไวขึ้นรึป่าว,1,#โรคซึมเศร้า
2021-09-19 10:45:56,13e1d3929b31,วันนี้ไม่อยากกินยาแล้วอยากจะจากโลกนี้ไปเป็นเพียงความทรงจำก็พอเจ็บปวด,1,#โรคซึมเศร้า
2021-06-17 3:46:43,976063cef5b3,ต้องกินยากี่เม็ดถึงจะเกือบตายคะหรือต้องกินกับแอลกอฮอล์,4,#โรคซึมเศร้า
2021-08-31 13:23:50,976063cef5b3,ยืนยันว่าความตายไม่ได้น่ากลัวแบบที่ทุกคนคิดสุดท้ายแล้วมันคือความว่างเปล่าเหมือนก้อนเมฆบนท้องฟ้าก็เท่านั้น,5,#โรคซึมเศร้า
2021-09-04 14:44:00,976063cef5b3,ถ้าวันนึงฉันทนไม่ไหวแล้วมันกลายเป็นว่าไม่ฉันรักตัวเองเลยเหรอ,1,#โรคซึมเศร้า
2021-09-14 13:05:15,976063cef5b3,ถ้าตอนนี้มีใครมาฆ่ากูให้ตายก็คงดี,1,#โรคซึมเศร้า
2021-08-05 23:05:07,9b775d4e2ab7,ทำไมไม่เป็นเราที่ตายคนอยากตายอยู่ตรงนี้ให้คนที่เขาอยากมีชีวิตได้มีชีวิตอยู่ต่อไปเถอะ,1,#โรคซึมเศร้า
2021-05-18 5:46:27,5758f9083a5e,ไหนอะเหตุผลที่ทำให้อยากอยู่ต่อ,1,#โรคซึมเศร้า
2021-08-02 17:25:54,5758f9083a5e,ทำไมการมีชีวิตอยู่ถึงทรมานแบบนี้นะ,1,#โรคซึมเศร้า
2021-05-18 5:45:15,5758f9083a5e,กินยาแล้วแต่ไม่ง่วงเลยแต่ก็ทำงานไม่ได้เช่นกันไร้ประโยชน์สิ้นดี,other,#โรคซึมเศร้า
2021-06-23 16:06:55,1bff02682eec,มีใครวางแผนว่าจะจากไปภายในสิ้นปีนี้บ้าง,2,#โรคซึมเศร้า
2021-05-14 14:27:11,4ff4aa83a4df,ถ้าหายไปคงดีสินะ,1,#โรคซึมเศร้า
2021-05-14 14:27:11,4ff4aa83a4df,ถ้าหายไปคงดีสินะ,1,#โรคซึมเศร้า
2021-05-14 14:18:56,4ff4aa83a4df,ต้องอยู่กับมันอีกนานเท่าไร,1,#โรคซึมเศร้า
2021-06-29 5:36:14,e751bdbfbcc4,เหนื่อยที่จะตามงานแล้วเหนื่อยที่จะใช้ชีวิตแล้วเหนื่อยที่จะอยู่ต่อไปแล้วขอหลับไปตลอดกาลเถอะนะ,1,#ซึมเศร้า #ปัญหาครอบครัว #อยากตาย
2021-08-26 19:19:03,f36be2d4eeff,แค่เรื่องบางเรื่องยังตัดสินใจเองไม่ได้เลือกเองไม่ได้ทุกอย่างมันต้องขึ้นอยู่กับคนรอบข้างงั้นหรือ,other,#อยากตาย
2021-07-12 14:22:34,4ba1846fe0c6,ทำไมเราถึงไม่ตายไปให้มันจบอะ,1,#โรคซึมเศร้า
2021-05-18 20:19:46,8300ba0eba8a,หรือทางเดียวที่จะหลุดพ้นได้คือความตาย,1,#โรคซึมเศร้า
2021-05-17 17:34:44,8300ba0eba8a,เหนื่อยและท้อหาความสุขให้ตัวเองไม่ได้จนบางครั้งก็รู้สึกว่าไม่ไหวอยากตายไปจากโลกนี้,1,#โรคซึมเศร้า
2021-05-30 5:55:56,ff07cb317b2f,หมอถามว่ามีความคิดอยากฆ่าตัวตายมั๊ยเราไม่ได้อยากฆ่าตัวตายนะเราแค่อยากหายไปเฉยๆ,1,#โรคซึมเศร้า
2021-07-15 17:56:24,73f217c79b73,พรุ่งนี้ไม่อยากตื่นเลยขอไม่ตื่นมาได้ไหมขอร้องละเราไม่อยากตื่นไม่อยากตื่นเลยสักนิดเดียว,3,#โรคซึมเศร้า #โรคเครียด
2021-08-17 16:48:24,93d0a596cf97,เจ็บปวดเศร้าสับสนทรมานมากเหลือเกินฉันอยากตายอยากตายมากๆจะคลั่งอยู่เเล้วจะประสาทกลับเเล้ว,3,#โรคซึมเศร้า #โรคแพนิค #depression #depressed
2021-06-26 15:33:33,6f333e4f0b58,เราตายในความคิดตัวเองเป็นร้อยๆรอบแล้วเมื่อไหร่จะตายจริงนะ,3,#โรคซึมเศร้า
2021-06-09 10:37:11,b7776cf501a9,หลังจากฆ่าตัวตายไม่สำเร็จวันนี้ต้องย้ายไปอยู่แผนกจิตเวช,5,#โรคซึมเศร้า #ซึมเศร้า
2021-06-09 10:35:24,b7776cf501a9,เก่งเหมือนกันนะที่พยายามอยู่ทั้งๆที่ไม่อยากอยู่,1,#โรคซึมเศร้า #อยากตายตั้งแต่อายุ16 #ซึมเศร้า #อยากตาย
2021-06-10 21:36:41,b7776cf501a9,ก็จริงที่ชีวิตมันมีครั้งเดียวแต่ทำไมมันถึงไม่น่าอยู่,1,#ซึมเศร้า  #โรคซึมเศร้า #อยากตาย#อยากตายตั้งแต่อายุ16 #เสียงกระซิบจากความมืด
2021-06-10 21:00:34,b7776cf501a9,เหนื่อยเหนื่อยเหนื่อยไม่ไหวแล้ว,1,#ซึมเศร้า #อยากตาย
2021-06-10 20:55:36,b7776cf501a9,ถ้าการที่เราร้องไห้แล้วมันดีขึ้นมันก็ดีแต่เราร้องไห้บ่อยเกินไปจนเราไม่อยากร้องไห้มันอีกแล้ว,1,#ซึมเศร้า #อยากตาย #โรคซึมเศร้า
2021-06-09 10:37:11,b7776cf501a9,ตายไปตั้งแต่แรกก็ดี,1,#โรคซึมเศร้า #ซึมเศร้า
2021-06-09 10:35:24,b7776cf501a9,กุอิจฉาคนที่ตายไปแล้วว่ะ,1,#โรคซึมเศร้า #อยากตายตั้งแต่อายุ16 #ซึมเศร้า #อยากตาย
2021-06-10 21:00:34,b7776cf501a9,ใครสนใจละถ้ากูตายไปแล้วมึงจะมาเสียใจให้กูทำไมทั้งๆที่มึงไม่ได้ทำดีกับกูทั้งแต่แรกแล้ว,1,#ซึมเศร้า #อยากตาย
2021-06-10 20:55:36,b7776cf501a9,ฉันทำทุกอย่างไปเพื่ออะไร,other,#ซึมเศร้า #อยากตาย #โรคซึมเศร้า
2021-06-17 4:07:00,b7776cf501a9,อยากตายทุกวันเลยอีเหี้ย,1,#โรคซึมเศร้า #ซึมเศร้า
2021-07-07 7:15:18,b7776cf501a9,เพื่อจะมีชีวิตอยู่ต้องปรับตัวเพื่อที่จะรักใครสักคนต้องปรับใจแต่ถึงอยู่ไปก็ไม่มีใครรักหรอก,1,#โรคซึมเศร้า
2021-07-12 12:17:28,b7776cf501a9,เหนื่อยเหนื่อยจริงๆเหนื่อยจนอยากหายไปจากที่นี้,1,#เรียนออนไลน์เราจะตายกันหมด
2021-07-12 12:02:37,b7776cf501a9,ถ้าตายตอนนี้คงไม่รู้สึกอะไรแล้วแหละหลับสบายคงดี,3,#อยากตาย #โรคซึมเศร้า #ซึมเศร้า#กรีดแขน #อยากตาย
2021-07-19 3:50:05,b7776cf501a9,โลกนี้โหดร้ายกับฉันจัง,1,#โรคซึมเศร้า #อยากตาย
2021-07-19 3:50:05,b7776cf501a9,หลายคนดิ้นรนเพื่อต่อลมหายใจแต่การหายใจสำหรับฉันมันเหนื่อยเจียนตาย,1,#โรคซึมเศร้า #อยากตาย
2021-07-23 18:31:41,b7776cf501a9,ก็แหงแหละไม่มีใครเข้าใจผมหรอกว่าต้องทุกข์ทรมานแค่ไหน,1,#โรคซึมเศร้า #ซึมเศร้า #อยากตาย
2021-07-23 18:29:31,b7776cf501a9,หมดหนทางการใช้ชีวิตแล้ว,1,#โรคซึมเศร้า #ซึมเศร้า #อยากตาย
2021-07-22 21:31:32,b7776cf501a9,เหนื่อยมากเลยโว้ยจะทนไม่ไหวเเล้ว,1,#โรคซึมเศร้า #อยากตาย
2021-07-22 13:17:06,b7776cf501a9,เมื่อไหร่กูจะตายวะอีเหี้ยเบื่อฉิบหายเวลากรรมของกูทำไมยาวนานจังอีสัสรีบๆตายเหอะกูเนี่ยเหนื่อยแล้วไอเวร,1,#โรคซึมเศร้า #อยากตาย
2021-07-24 2:18:45,b7776cf501a9,เมื่อไหร่กูจะตายวะอีเหี้ยเบื่อฉิบหายเวลากรรมของกูทำไมยาวนานจังอีสัสรีบๆตายเหอะกูเนี่ยเหนื่อยแล้วไอเวร,1,#อยากตาย #โรคซึมเศร้า
2021-07-23 18:31:41,b7776cf501a9,ถ้ามีหนูเป็นลูกมันแย่มากหนูตายให้ก็ได้นะหนูไม่ได้เสียดายชีวิตเท่าไหร่หรอก,2,#โรคซึมเศร้า #ซึมเศร้า #อยากตาย
2021-07-23 18:29:31,b7776cf501a9,เเนะนำวิธีทำร้ายตัวเองเเบบไม่เจ็บให้หน่อยค่ะ,3,#โรคซึมเศร้า #ซึมเศร้า #อยากตาย
2021-07-30 19:23:09,b7776cf501a9,ในความคิดฉันตายเป็นพันครั้งต่อนาที,1,#โรคซึมเศร้า #ซึมเศร้า #อยากตาย
2021-07-29 22:34:50,b7776cf501a9,ไม่อยากอยู่แล้ว,1,#โรคซึมเศร้า #ซึมเศร้า #อยากตาย
2021-08-10 12:31:31,b7776cf501a9,ชีวิตนี้ไม่หวังอะไรอีกแล้วอยู่ไปก็ไม่มีความหมายอะไรอีกแล้วโลกนี้มันช่างโหดร้ายเกินที่คนอย่างเราจะทนไหว,3,#โรคซึมเศร้า #ซึมเศร้า
2021-08-11 19:47:48,b7776cf501a9,พูดได้เต็มปากเลยถ้าเราฆ่าตัวตายต้นเหตุมาจากพ่อแม่ทั้งหมด,2,#โรคซึมเศร้า #ซึมเศร้า
2021-08-18 19:16:33,b7776cf501a9,แรงในบัลดาลใจสุดท้ายในการมีชีวิตอยู่เริ่มถูกทำลายไปช้าๆโดยที่เราทำอะไรไม่ได้เลยได้แต่เฝ้าดูแล้วทรมานกับสิ่งที่เป็น,1,#โรคซึมเศร้า #ซึมเศร้า
2021-08-18 19:14:36,b7776cf501a9,กูไม่อยากมีชีวิตไม่อยากใช้ชีวิตแล้วอะกูผิดมากหรอวะ,1,#โรคซึมเศร้า #ซึมเศร้า
2021-08-18 19:00:54,b7776cf501a9,อยากตายขอวิธีตายแบบง่ายๆหน่อยสิ,3,#โรคซึมเศร้า #ซึมเศร้า
2021-08-17 18:25:27,b7776cf501a9,ถ้าติดโควิดจริงก็ขอให้ตายเลยนะ,1,#โรคซึมเศร้า
2021-08-17 18:08:06,b7776cf501a9,เราเหนื่อยที่แปลว่าเราเหนื่อยกับการมีชีวิตบนโลกใบนี้ไม่ได้เหนื่อยเพราะทำงานหรือเพราะอะไร,1,#โรคซึมเศร้า #ซึมเศร้า
2021-08-18 19:21:20,b7776cf501a9,เกลียดตัวเองชอบหายมีแต่ทำให้อะไรๆแย่ลงเราควรอยู่คนเดียวไม่ก็หายไปซะ,1,#โรคซึมเศร้า #ซึมเศร้า
2021-08-17 18:25:27,b7776cf501a9,ถ้าวันหนึ่งผมตายไปใครละที่จะเสียใจ,other,#ซึมเศร้า #โรคซึมเศร้า
2021-08-17 18:04:58,b7776cf501a9,กูยังทรมานไม่พออีกหรอวะต้องตายก่อนหรือไงกัน,1,#มออุบล #ซึมเศร้า
2021-08-17 17:54:46,b7776cf501a9,ทำไมต้องเกิดมาอ้วนถามตัวเองซ้ำๆทุกวันเคยตั้งใจออกกำลังกายคุมอาหารแต่น้ำหนักก็ไม่ลดเลยท้อเครียดเหนื่อยอยากตาย,1,#โรคซึมเศร้า #ซึมเศร้า
2021-08-17 9:02:58,b7776cf501a9,จะตายไหมคะ,other,#โรคซึมเศร้า #ซึมเศร้า
2021-08-25 2:07:00,b7776cf501a9,รู้อยู่แก่ใจแหละว่าอยากตายแต่เสียดายที่เป็นปืนปลอม,5,#โรคซึมเศร้า #ซึมเศร้า #โรคเครียด #อยากตาย
2021-08-18 19:21:20,b7776cf501a9,เกลียดตัวเองชอบหายมีแต่ทำให้อะไรๆแย่ลงเราควรอยู่คนเดียวไม่ก็หายไปซะ,1,#โรคซึมเศร้า #ซึมเศร้า
2021-08-18 19:11:51,b7776cf501a9,อยากจะบอกทุกคนให้รับรู้นะคนที่เป็นซึมเศร้าอะเขาไม่คิดจะทำร้ายคนอื่นเขาคิดทำร้ายตัวเอง,other,#โรคซึมเศร้า #ซึมเศร้า
2021-08-17 18:25:27,b7776cf501a9,ถ้าวันหนึ่งผมตายไปใครละที่จะเสียใจ,other,#ซึมเศร้า #โรคซึมเศร้า
2021-08-17 18:04:58,b7776cf501a9,กูยังทรมานไม่พออีกหรอวะต้องตายก่อนหรือไงกัน,1,#มออุบล #ซึมเศร้า
2021-08-17 17:54:46,b7776cf501a9,ทำไมต้องเกิดมาอ้วนถามตัวเองซ้ำๆทุกวันเคยตั้งใจออกกำลังกายคุมอาหารแต่น้ำหนักก็ไม่ลดเลยท้อเครียดเหนื่อยอยากตาย,1,#โรคซึมเศร้า #ซึมเศร้า
2021-08-17 9:02:58,b7776cf501a9,จะตายไหมคะ,other,#โรคซึมเศร้า #ซึมเศร้า
2021-08-23 15:27:03,b7776cf501a9,ใครมีวิธีหยุดความคิดอยากทำร้ายตัวเองบ้างง่า,5,#โรคซึมเศร้า
2021-08-26 3:48:36,b7776cf501a9,ขอวิธีฆ่าตัวตายค่ะจริงจังค่ะ,3,#โรคซึมเศร้า #ซึมเศร้า
2021-08-26 3:47:23,b7776cf501a9,กูขอวิธีฆ่าตัวตายขอร้องจริงจังทนไม่ไหวกับชีวิตนี้แล้ว,3,#โรคซึมเศร้า #ซึมเศร้า
2021-08-26 1:39:24,b7776cf501a9,อยากตายโดยไม่ต้องทำร้ายตัวเอง,1,#โรคซึมเศร้า #ซึมเศร้า
2021-08-25 2:50:34,b7776cf501a9,เราฆ่าตัวตายดีมั้ยเราเหนื่อยๆมากเราเกลียดครอบครัวตัวเอง,2,#โรคซึมเศร้า
2021-08-25 1:49:12,b7776cf501a9,อยากหายไปโดยที่คนรอบข้างไม่รับรู้,1,#โรคซึมเศร้า #โรคเครียด #ซึมเศร้า #เครียด
2021-08-25 2:07:00,b7776cf501a9,ซักวันเราจะจากไปอย่างเงียบๆโดยที่พวกคุณไม่ต้องลำบาก,1,"#โรคซึมเศร้า #ซึมเศร้า #โรคเครียด 
#อยากตาย"
2021-09-04 7:32:02,b7776cf501a9,โลกหลังความตายจะสบายกว่าโลกนี้รึป่าว,other,#โรคซึมเศร้า #ซึมเศร้า
2021-05-14 15:22:20,13c080babc96,อยากนอนหลับไปแล้วไม่ต้องตื่นเลยไม่ต้องมารับรู้อะไรเกี่ยวกับโลกนี้แล้ว,1,#โรคซึมเศร้า
2021-05-14 15:22:20,13c080babc96,อยากนอนหลับไปแล้วไม่ต้องตื่นเลยไม่ต้องมารับรู้อะไรเกี่ยวกับโลกนี้แล้ว,1,#โรคซึมเศร้า
2021-07-27 16:05:52,fae39ec91fd9,เรากล้าที่จะกรีดตรงคอแล้วนะ,5,#ซึมเศร้า #โรคซึมเศร้า #ครอบครัวไม่ใช่เซฟโซน
2021-07-04 14:36:29,2b8f37170b4e,บ่นเหนื่อยรอบที่ล้านทำไมไม่ตายๆไปสักทีวะตัวกู,1,#โรคซึมเศร้า
2021-06-24 14:16:43,2f67905be441,เห้อเราต้องมีความรู้สึกแบบนี้ไม่ถึงเมื่อไหร่เครียดปัญหาเหนื่อยท้อแท้กับชีวิต,other,#อยากตาย #โรคซึมเศร้า
2021-05-15 10:50:06,2b4fa5878b26,ชีวิตที่ไร้ความหมาย,1,#โรคซึมเศร้า
2021-09-11 1:02:03,2b4fa5878b26,พอกลางคืนชั่ววูบนึงมันก็จะดิ่งๆให้มันจบๆไปดีกว่าไหมชีวิตที่ไม่มีค่านี้,2,#โรคซึมเศร้า #โรคซึมเศร้าปี2
2021-09-17 14:24:06,47d4853de6a1,การมีชีวิตอยู่ไม่น่าจดจำเท่ากับการจากไป,1,#โรคซึมเศร้า #วันศุกร์กับซึมเศร้า
2021-09-17 14:24:06,47d4853de6a1,อยากหายไปจากทุกคนเลย,1,#โรคซึมเศร้า #วันศุกร์กับซึมเศร้า
2021-08-17 16:18:48,7f96e8002228,ไม่ต้องสนใจรอยแผลพวกนี้หรอก,5,#โรคซึมเศร้า
2021-05-28 7:47:40,372e9c133252,ไม่ใช่ว่าอยากจะตายแต่การมีชีวิตอยู่มันทรมาน,other,#โรคซึมเศร้า
2021-05-28 13:43:13,4b6d444c656b,มันกลับมาอีกแล้วเครียดจนอยากจะเอามีดมาปาดคอตัวเองให้ตายอยู่แล้วใครก็ได้บอกเขาหยุดพูดทีหยุดตอกย้ำกันสักที,4,#โรคซึมเศร้า
